"","Species","Order","Family","Genus","Species.1","BDT.C","UDT.C","EADDC","EEDDC","OS","ET","LT","TL1","TL2","TL3","TL4","TL5","TP","TMA","TOA","DE","DLT","D1","D2","D3","D4","D5","DP","DMA","DOA","DBE","DBLT","DB1","DB2","DB3","DB4","DB5","DBP","DBMA","DBOA","Author","Year","Title","Journal","Vol","Pages","Location","Lab","BDT.c","lon","lat"
"1303","Rhopalosiphum padi","Homoptera","Aphididae","Rhopalosiphum","padi",7.47,27.5,92.38,NA,"","",NA,NA,"","","","",NA,NA,NA,"",NA,"","","","","",NA,NA,NA,"",NA,NA,NA,NA,NA,"","",NA,"","Asin, L. and Pons, X.",2001,"Effect of high temperature on the growth and reproduction of corn aphids (Homoptera: Aphididae) and implications for their population dynamics on the Northeastern Iberian Peninsula.","Environmental Entomology","30","1127?1134.","","",7.47,43.3729793,38.5012085
"1304","Rhopalosiphum padi","Homoptera","Aphididae","Rhopalosiphum","padi",4.3,28,140.8,NA,"","",NA,NA,"","","","",NA,NA,NA,"",NA,"","","","","",NA,NA,NA,"",NA,NA,NA,NA,NA,"","",NA,"","Auad, A.M., Alves, S.O., Carvalho, C.A., Silva, D.M., Resende, T.T. and Verissimo,B.A.",2009,"The impact of temperature on biological aspects and life table of Rhopalosiphum padi (Hemiptera: Aphididae) fed with signal grass.","Florida Entomologist","92","569?577.","","",4.3,43.3729793,38.5012085
"1305","Rhopalosiphum padi","Homoptera","Aphididae","Rhopalosiphum","padi",6.36,23,78.75,NA,"","",NA,NA,"","","","",NA,NA,NA,"",NA,"","","","","",NA,NA,NA,"",NA,NA,NA,NA,NA,"","",NA,"","Elliott, N.C. and Kieckhefer, R.W.",1989,"Effects of constant and fluctuating temperatures on immature development and age-specific life tables of Rhopalosiphum padi (L.) (Homoptera: Aphididae).","Canadian Entomologist","121","131?140.","","",6.36,43.3729793,38.5012085
"1306","Rhopalosiphum padi","Homoptera","Aphididae","Rhopalosiphum","padi",3.55,25,92.04,NA,"","",NA,NA,"","","","",NA,NA,NA,"",NA,"","","","","",NA,NA,NA,"",NA,NA,NA,NA,NA,"","",NA,"","Guo, L. and Liu,S.",1998,"Effect of temperature on the development and reproduction of Rhopalosiphus padi (Linnaeus).","J. Zhanjiang Ocean Univ.","18 (3)","73?76 (in Chinese).","","",3.55,43.3729793,38.5012085
"1307","Rhopalosiphum padi","Homoptera","Aphididae","Rhopalosiphum","padi",6.32,25,110,NA,"","",NA,NA,"","","","",NA,NA,NA,"",NA,"","","","","",NA,NA,NA,"",NA,NA,NA,NA,NA,"","",NA,"","Li, T., Li, Q. and He, S.",1991,"Oat bird-cherry aphids? growth and development: temperature effects.","J. Southwest Agric. Univ","13 (4)","390?392 (in Chinese).","","",6.32,43.3729793,38.5012085
"1308","Rhopalosiphum padi","Homoptera","Aphididae","Rhopalosiphum","padi",11.1,25,49.86,NA,"","",NA,NA,"","","","",NA,NA,NA,"",NA,"","","","","",NA,NA,NA,"",NA,NA,NA,NA,NA,"","",NA,"","Tanaka, T.",1961,"The rice root aphids, their ecology and control.","In: Proceeding of the Special Bulletin of the College of Agriculture Utsunomiya University, Utsunomiya, Japan","10","pp. 1?74 (in Japanese).","","",11.1,43.3729793,38.5012085
"1309","Rhopalosiphum padi","Homoptera","Aphididae","Rhopalosiphum","padi",-5.63,NA,179.59,NA,"","",NA,NA,"","","","",NA,NA,NA,"",NA,"","","","","",NA,NA,NA,"",NA,NA,NA,NA,NA,"","",NA,"","Asin, L. and Pons, X.",2001,"Effect of high temperature on the growth and reproduction of corn aphids (Homoptera: Aphididae) and implications for their population dynamics on the northeastern Iberian Peninsula.","Environmental Entomology","30(6)","1127-1134","Spain, Lleida 42¯N","",-5.63,NA,NA
"1310","Rhopalosiphum padi","Homoptera","Aphididae","Rhopalosiphum","padi",5.38,22.79,88.5,103.98,"","-",5.87,5.74,"6.85","5.67","5.48","",NA,2.4,NA,"-",88.5,"17.7","16.98","19.98","32.32","",NA,12.23,NA,"",NA,NA,NA,NA,NA,"","",NA,"","Elliott, N. C. and R. W. Kieckhefer",1989," Effects of constant and fluctuating temperatures on immature development and age-specific life tables of Rhopalosiphum padi (L.) (Homoptera: Aphididae)","Canadian Entomologist","121"," 131-140","USA, South Dakota","",5.38,NA,NA
"1311","Rhopalosiphum padi","Homoptera","Aphididae","Rhopalosiphum","padi",5.61,23.83,82.92,90.01,"","-",5.76,5.79,"5.73","6.07","6.19","",NA,2.97,NA,"-",82.92,"22.07","18.64","17.93","20.15","",NA,6.06,NA,"",NA,NA,NA,NA,NA,"","",NA,"","Elliott, N. C. and R. W. Kieckhefer",1989," Effects of constant and fluctuating temperatures on immature development and age-specific life tables of Rhopalosiphum padi (L.) (Homoptera: Aphididae)","Canadian Entomologist","121"," 131-140","USA, South Dakota","",5.61,NA,NA
"1312","Rhopalosiphum padi","Homoptera","Aphididae","Rhopalosiphum","padi",5.78,25.09,86,97,"","",NA,NA,"","","","",NA,NA,NA,"",NA,"","","","","",NA,NA,NA,"",NA,NA,NA,NA,NA,"","",NA,"","Elliott, N. C. and R. W. Kieckhefer",1989,"Effects of constant and fluctuating temperatures on immature development and age-specific life tables of Rhopalosiphum padi (L.) (Homoptera: Aphididae)","Canadian Entomologist","121"," 131-140","USA, South Dakota","",5.78,NA,NA
"1313","Rhopalosiphum padi","Homoptera","Aphididae","Rhopalosiphum","padi",3.2,NA,122.1,NA,"","",NA,NA,"","","","",NA,NA,NA,"",NA,"","","","","",NA,NA,NA,"",NA,NA,NA,NA,NA,"","",NA,"","Sengonca S., Hoffmann A., Kleinhenz B.",1994,"Laboruntersuchungen zur Entwicklung, Lebensdauer und Fruchtbarkeit der Getreideblattlausarten Silobion avenae (F.) und Rhopalosiphum padi (L.) (Hem., Aphididae) bei verschiedenen tieferen Temperaturen.","Journal of Applied Entomology","117","224-233","SRN Bonn","",3.2,NA,NA
"1314","Rhopalosiphum pseudobrassicae","Homoptera","Aphididae","Rhopalosiphum","pseudobrassicae",7.69,25,123.43,NA,"","",NA,NA,"","","","",NA,NA,NA,"",NA,"","","","","",NA,NA,NA,"",NA,NA,NA,NA,NA,"","",NA,"","Kawada, K.",1964,"The influence of constant temperature on the development, longevity and reproduction of the turnip aphid, Rhopalosiphum pseudobrassicae Davis.","Ber. Ohara Inst.","12 (3)","243?250.","","",7.69,43.3729793,38.5012085
"1316","Schizaphis graminum","Homoptera","Aphididae","Schizaphis","graminum",5.86,NA,93.19,NA,"","",5.86,5.42,"5.95","5.86","6.31","",NA,7.52,NA,"",93.19,"25.63","20.85","21.52","23.04","",NA,5.87,NA,"",NA,NA,NA,NA,NA,"","",NA,"","Walgenbach, D. D., N. C. Elliott, and Kieckhefer, R.W.",1988,"Constant and fluctuating temperature effects on developmental rates and life table statistics of the green bug (Homoptera: Aphididae)","Journal of Economic Entomology","81"," 501-507","USA, South Dakota, northern plains","",5.86,NA,NA
"1317","Schizaphis gramium","Homoptera","Aphididae","Schizaphis","gramium",6.57,26,88.79,NA,"","",NA,NA,"","","","",NA,NA,NA,"",NA,"","","","","",NA,NA,NA,"",NA,NA,NA,NA,NA,"","",NA,"","Walgenbach, D.D., Elliott, N.C. and Kieckhefer,R.W.",1988,"Constant fluctuating temperature effects on developmental rates and life table statistics of the greenbug (Homoptera: Aphididae).","Journal of Economic Entomology","81","501?507.","","",6.57,43.3729793,38.5012085
"1318","Silobion avenae","Homoptera","Aphididae","Silobion","avenae",3.9,NA,150.8,NA,"","-",3.9,4.3,"3.4","3.1","4.4","",NA,NA,NA,"-",150.8,"35.4","30.6","33","51","",NA,NA,NA,"",NA,NA,NA,NA,NA,"","",NA,"","Kieckhefer, R. W., N. C. Elliott, et al.",1989,"Effects of constant and fluctuating temperatures on developmental rates and demographic statistics of the English Green Aphid (Homoptera: Aphididae)","Annals of the Entomological Society of America","82"," 701-706","USA, South Dakota, Minnesota, Nebrasca, Iowa ","laboratory studies)",3.9,NA,NA
"1319","Silobion avenae","Homoptera","Aphididae","Silobion","avenae",4.1,24.6,136.8,NA,"","-",4.1,4.3,"3.4","3.1","4.1","",NA,NA,NA,"-",136.8,"35.4","30.6","33","36.96","",NA,NA,NA,"",NA,NA,NA,NA,NA,"","",NA,"","Kieckhefer, R. W., N. C. Elliott, et al.",1989," Effects of constant and fluctuating temperatures on developmental rates and demographic statistics of the English Green Aphid (Homoptera: Aphididae)","Annals of the Entomological Society of America","82"," 701-706","USA, South Dakota, Minnesota, Nebrasca, Iowa ","laboratory studies)",4.1,NA,NA
"1320","Silobion avenae","Homoptera","Aphididae","Silobion","avenae",2.2,NA,171.4,NA,"","",NA,NA,"","","","",NA,NA,NA,"",NA,"","","","","",NA,NA,NA,"",NA,NA,NA,NA,NA,"","",NA,"","Sengonca S., Hoffmann A., Kleinhenz B.",1994,"Laboruntersuchungen zur Entwicklung, Lebensdauer und Fruchtbarkeit der Getreideblattlausarten Silobion avenae (F.) und Rhopalosiphum padi (L.) (Hem., Aphididae) bei verschiedenen tieferen Temperaturen.","Journal of Applied Entomology","117","224-233","SRN Bonn","",2.2,NA,NA
"1321","Silobion avenae","Homoptera","Aphididae","Silobion","avenae",3,NA,150.1,NA,"","-",NA,NA,"","","","",NA,NA,NA,"-",NA,"","","","","",NA,NA,NA,"-",NA,40.1,34,39,43.5,"","-",17.4,"","Williams, C. T. and S. D. Wratten",1987," The winter development, reproduction and lifespan of viviparae of Sitobion avenae (F.) (Hemiptera: Aphididae) on wheat in England","Bulletin of Entomological Research","77"," 19-34","UK, near Southampton","",3,NA,NA
"1322","Silobion avenae","Homoptera","Aphididae","Silobion","avenae",3,NA,163.6,NA,"","-",NA,NA,"","","","",NA,NA,NA,"-",NA,"","","","","",NA,NA,NA,"-",NA,37.7,32.1,38.5,58.6,"","-",31.7,"","Williams, C. T. and S. D. Wratten",1987," The winter development, reproduction and lifespan of viviparae of Sitobion avenae (F.) (Hemiptera: Aphididae) on wheat in England","Bulletin of Entomological Research","77"," 19-34","UK, near Southampton","",3,NA,NA
"1323","Sipha flava","Homoptera","Aphididae","Sipha","flava",4.23,24,172.18,NA,"","",NA,NA,"","","","",NA,NA,NA,"",NA,"","","","","",NA,NA,NA,"",NA,NA,NA,NA,NA,"","",NA,"","de Oliveira, S.A., Souza, B., Auad, A.M., da Silva, D.M., Souza, L.S. and Carvalho, C.A.",2009,"Development and reproduction of Sipha flava (Forbes) (Hemiptera: Aphididae) at different temperatures.","Neotrop. Entomol.","38","311?316 (in French).","","",4.23,43.3729793,38.5012085
"1324","Sitobion avenae","Homoptera","Aphididae","Sitobion","avenae",-8.27,NA,239.38,NA,"","",NA,NA,"","","","",NA,NA,NA,"",NA,"","","","","",NA,NA,NA,"",NA,NA,NA,NA,NA,"","",NA,"","Asin, L. and Pons, X.",2001,"Effect of high temperature on the growth and reproduction of corn aphids (Homoptera: Aphididae) and implications for their population dynamics on the northeastern Iberian Peninsula.","Environmental Entomology","30(6)","1127-1134","Spain, Lleida 42¯N","",-8.27,NA,NA
"1325","Sitobion avenae","Homoptera","Aphididae","Sitobion","avenae",4.98,24,119.04,NA,"","",NA,NA,"","","","",NA,NA,NA,"",NA,"","","","","",NA,NA,NA,"",NA,NA,NA,NA,NA,"","",NA,"","Hu, Z., Zhao, H., Hu, X. and Li, D.",2007,"Effect of bacterial symbionts on growth, development and fecundity of Sitobion avenae (F.) (Homoptera: Aphididae). ","J. Northwest A & F Univ.(Nat. Sci. Ed.)","35 (6)","163?166 (in Chinese).","","",4.98,43.3729793,38.5012085
"1328","Toxoptera citricida","Homoptera","Aphididae","Toxoptera","citricida",5.2,NA,173.6,NA,"","",NA,NA,"","","","",NA,NA,NA,"",NA,"","","","","",NA,NA,NA,"",NA,NA,NA,NA,NA,"","",NA,"","Komazaki, S.",1988,"Growth and reproduction in the first two summer generations of two citrus aphids, Aphis citricola Van Der Groot and Toxoptera citricidus (kirklady) (Homoptera: Aphididae), under different thermal conditions.","Appl. Entomol. Zool.","23","220-227","Japan","",5.2,138.252924,36.204824
"1331","Toxptera citricidus","Homoptera","Aphididae","Toxptera","citricidus",9.66,25.1,115.06,NA,"","",NA,NA,"","","","",NA,NA,NA,"",NA,"","","","","",NA,NA,NA,"",NA,NA,NA,NA,NA,"","",NA,"","Komazaki, S.",1982,"Effects of constant temperatures on population growth of three aphid species, Toxoptera citricidus (Kirkaldy), Aphis citricola van der Goot
and Aphis gossypii Glover (Homoptera: Aphididae) on citrus.","Appl. Entomol. Zool.","17","75-81","","",9.66,43.3729793,38.5012085
"1332","Toxptera citricidus","Homoptera","Aphididae","Toxptera","citricidus",8.75,24.9,97.4,NA,"","",NA,NA,"","","","",NA,NA,NA,"",NA,"","","","","",NA,NA,NA,"",NA,NA,NA,NA,NA,"","",NA,"","Komazaki, S.",1982,"Effects of constant temperatures on population growth of three aphid species, Toxoptera citricidus (Kirkaldy), Aphis citricola van der Goot
and Aphis gossypii Glover (Homoptera: Aphididae) on citrus.","Appl. Entomol. Zool.","17","75-81","","",8.75,43.3729793,38.5012085
"1333","Tuberolachnus salignus","Homoptera","Aphididae","Tuberolachnus","salignus",5.5,NA,196.4,NA,"","-",5.5,NA,"","","","",NA,NA,NA,"-",196.4,"","","","","",NA,NA,NA,"-",196.4,44.8,42.1,50.3,59.2,"","",NA,"","Collins, C. M. and S. R. Leather",2001,"Effect of temperature on fecundity and development of the giant willow aphid, Tuberolachnus salignus (Sternorrhyncha: Aphididae)","European Journal of Entomology","98","177-182","UK, Wiltshire","",5.5,NA,NA
"1337","Austroasca viridigrisea","Homoptera","Cicadellidae","Austroasca","viridigrisea",14,NA,239.4,NA,"","15.2",12,NA,"","","","",NA,NA,NA,"90.6",164.3,"","","","","",NA,NA,NA,"",NA,NA,NA,NA,NA,"","",NA,"","Page F.D.",1983,"Biology of Austroasca viridigrisea (Paoli) (Hemiptera: Cicadellidae).","Journal of the Australian Entomological Society","22","149-153","Australia-Qld-Biloek","",14,NA,NA
"1339","Cicadulina mbila","Homoptera","Cicadellidae","Cicadulina","mbila",12.9,NA,343.6,NA,"","11.7",NA,NA,"","","","",NA,NA,NA,"117.3",NA,"","","","","",NA,NA,NA,"",NA,NA,NA,NA,NA,"","",NA,"","Rensburg van G.D.J.",1982,"Laboratory observation on the biology of Cicadulina mbila (NaudÇ) (Homoptera: Cicadellidae), a vector of maize streak disease. l. Effect of temperature.","Phytophylactica","14","98-107","RSA  Potchertroost","",12.9,NA,NA
"1340","Cicadulina mbila","Homoptera","Cicadellidae","Cicadulina","mbila",13.7,NA,325.4,NA,"","11.7",NA,NA,"","","","",NA,NA,NA,"117.3",NA,"","","","","",NA,NA,NA,"",NA,NA,NA,NA,NA,"","",NA,"","Rensburg van G.D.J.",1982,"Laboratory observation on the biology of Cicadulina mbila (NaudÇ) (Homoptera: Cicadellidae), a vector of maize streak disease. l. Effect of temperature.","Phytophylactica","14","98-107","RSA  Potchertroost","",13.7,NA,NA
"1341","Circulifer opacipennis","Homoptera","Cicadellidae","Circulifer","opacipennis",15.1,NA,362.2,NA,"","16.1",16,NA,"","","","",NA,NA,NA,"114.6",162,"","","","","",NA,NA,NA,"",NA,NA,NA,NA,NA,"","",NA,"","Bindra O.S., Kaur P.",1970,"Influence of temperature on the rate of development of Circulifer opacipennis (Lethierry).","Indian J.Entomol.","32","174-177","India New Delhi","",15.1,77.2090212,28.6139391
"1342","Circulifer opacipennis","Homoptera","Cicadellidae","Circulifer","opacipennis",15.2,NA,307.6,NA,"","14.2",15.7,NA,"","","","",NA,NA,NA,"111.8",197.1,"","","","","",NA,NA,NA,"",NA,NA,NA,NA,NA,"","",NA,"","Sengonca C., Kersting V., Cinar A.",1991,"Laboratory studies on development and fecundity of Circulifer opacipennis (Lethierry) (Homoptera: Cicadellidae) an important vector of Spiroplasma citri Saglio et al. in the Mediterranean area.","Zeitschrift fur Pflanzenkrankheiten und Pflanzenschutz","98","650-654","Turkey ","?)",15.2,35.243322,38.963745
"1343","Circulifer tenellus","Homoptera","Cicadellidae","Circulifer","tenellus",14.4,35,361.1,NA,"","13.65",14.83,NA,"","","","",NA,NA,NA,"116.16",251.07,"","","","","",NA,NA,NA,"111.1",250,NA,NA,NA,NA,"","-",NA,"","Harries, F. H., and J. R. Douglass",1948,"Bionomic studies on the beet leafhopper","Ecological Monographs","18","47-79","USA, Idaho ","lab and field studies)",14.4,-114.7420408,44.0682019
"1344","Dikrella californica","Homoptera","Cicadellidae","Dikrella","californica",8.1,28,452.9,594.3,"","",NA,NA,"","","","",NA,NA,NA,"",NA,"","","","","",NA,NA,NA,"200.6",252.3,NA,NA,NA,NA,"","-",141.4,"","Williams, D. W.",1984,"Ecology of the blackberry-leafhopper-parasite system and its relevance to California grape agroecosystems","Hilgardia","52","32p","USA, California ","lab and field studies)",8.1,-76.5074542,38.3004029
"1346","Empoasca fabae","Homoptera","Cicadellidae","Empoasca","fabae",8.4,NA,312.5,NA,"","8.8",8.1,NA,"","","","",NA,NA,NA,"128.2",175.4,"","","","","",NA,NA,NA,"",NA,NA,NA,NA,NA,"","",NA,"","Hogg, D. B.",1985,"Potato leafhopper (Homoptera: Cicadellidae) immature development, life tables, and population dynamics under fluctuating temperature regimes","Environmental Entomology","14"," 349-355","USA Wisconsin","",8.4,-88.7878678,43.7844397
"1348","Empoasca fabae","Homoptera","Cicadellidae","Empoasca","fabae",11.4,30,435,NA,"","",NA,NA,"","","","",NA,NA,NA,"",NA,"","","","","",NA,NA,NA,"",NA,NA,NA,NA,NA,"","",NA,"","Kouskolekas, C. A., and G. C. Decker",1966,"The effect of temperature on the rate of development of the potato leafhopper, Empoasca fabae (Homoptera: Cicadellidae)","Annals of the Entomological Society of America","59","292-298","USA, Illinois ","field studies)",11.4,-89.3985283,40.6331249
"1349","Empoasca fabae","Homoptera","Cicadellidae","Empoasca","fabae",11.4,30,459,NA,"","",NA,NA,"","","","",NA,NA,NA,"",NA,"","","","","",NA,NA,NA,"",NA,NA,NA,NA,NA,"","",NA,"","Kouskolekas, C. A., and G. C. Decker",1966,"The effect of temperature on the rate of development of the potato leafhopper, Empoasca fabae (Homoptera: Cicadellidae)","Annals of the Entomological Society of America","59","292-298","USA, Illinois ","lab studies)",11.4,-89.3985283,40.6331249
"1350","Empoasca fabae","Homoptera","Cicadellidae","Empoasca","fabae",8.3,NA,396.1,NA,"","9.2",7.7,NA,"","","","",NA,NA,NA,"141.9",258.6,"","","","","",NA,NA,NA,"",NA,NA,NA,NA,NA,"","",NA,"","Sher R.B., Shields E.J.",1991,"Potato leafhopper (Homoptera: Cicadellidae) oviposition and development under cool fluctuating temperatures.","Environmental Entomology","20","1113-1120","USA, New York,  Ithaca","",8.3,NA,NA
"1351","Empoasca fabae","Homoptera","Cicadellidae","Empoasca","fabae",8.9,NA,352.2,NA,"","9.2",8.8,NA,"","","","",NA,NA,NA,"141.9",210.6,"","","","","",NA,NA,NA,"",NA,NA,NA,NA,NA,"","",NA,"","Sher R.B., Shields E.J.",1991,"Potato leafhopper (Homoptera: Cicadellidae) oviposition and development under cool fluctuating temperatures.","Environmental Entomology","20","1113-1120","Hawaii","",8.9,-155.5827818,19.8967662
"1354","Erythroneura comes","Homoptera","Cicadellidae","Erythroneura","comes",10,NA,497,580,"","",NA,NA,"","","","",NA,NA,NA,"",NA,"","","","","",NA,NA,NA,"208",289,57,46,45,53,"88","-",83,"","Martinson, T. E. and T. J. Dennehy",1995,"Influence of temperature-driven phenology and photoperiodic induction of reproductive diapause on population dynamics of Erythroneura comes (Homoptera: Cicadellidae)","Environmental Entomology","24"," 1504-1514","USA, New York, Geneva","",10,-76.985557,42.8679836
"1356","Erythroneura elegantula","Homoptera","Cicadellidae","Erythroneura","elegantula",10.3,NA,544.4,NA,"","",NA,NA,"","","","",NA,NA,NA,"",NA,"","","","","",NA,NA,NA,"",NA,NA,NA,NA,NA,"","",NA,"","Jensen, F. L., and D. L. Flaherty",1982,"Grape Leafhopper","In: Grape Pest Management. U.C. Div. Agr. Sci. Publ. #4105","","95-110","USA, California","",10.3,-119.4179324,36.778261
"1357","Graminella nigrifrons","Homoptera","Cicadellidae","Graminella","nigrifrons",13.7,NA,237.6,NA,"","",NA,NA,"","","","",NA,NA,NA,"",NA,"","","","","",NA,NA,NA,"",NA,NA,NA,NA,NA,"","",NA,"","Larsen K.J., Madden L.V., Nault L.R.",1990,"Effect of temperature and host plant on the development of the blackfaced leafhopper.","Entomologia Experimentalis et Applicata","55","285-294","USA Ohio","",13.7,-82.907123,40.4172871
"1358","Graminella nigrifrons","Homoptera","Cicadellidae","Graminella","nigrifrons",13.2,NA,349.3,NA,"","14.2",12.6,NA,"","","","",NA,NA,NA,"98.3",254.4,"","","","","",NA,NA,NA,"",NA,NA,NA,NA,NA,"","",NA,"","Sedlacek J.D., Yeargan K.V., Freytag P.H.",1990,"Effect of temperature on the development of the blackfaced leafhopper (Homoptera: Cicadellidae).","Environmental Entomology","19(2)","209-214","USA Kentucky","",13.2,NA,NA
"1359","Graminella nigrifrons","Homoptera","Cicadellidae","Graminella","nigrifrons",13.8,NA,311,NA,"","14.1",13.7,NA,"","","","",NA,NA,NA,"98.8",212.9,"","","","","",NA,NA,NA,"",NA,NA,NA,NA,NA,"","",NA,"","Sedlacek J.D., Yeargan K.V., Freytag P.H.",1990,"Effect of temperature on the development of the blackfaced leafhopper (Homoptera: Cicadellidae).","Environmental Entomology","19(2)","209-214","USA Kentucky","",13.8,NA,NA
"1361","Macrosteles fascifrons","Homoptera","Cicadellidae","Macrosteles","fascifrons",10.55,NA,356.1,NA,"","",NA,NA,"","","","",NA,NA,NA,"",NA,"","","","","",NA,NA,NA,"110",246.1,NA,NA,NA,NA,"","-",NA,"","Jensen, J. O. and R. K. Chapman",1979,"A curvilinear method for the determination of the base temperature and heat units associated with aster leafhopper development (Chairman)","Proceedings of the North Central Branch of the Entomological Society of America 1978","33","53p","USA, Wisconsin","",10.55,-88.7878678,43.7844397
"1366","Typhlocyba froggatti","Homoptera","Cicadellidae","Typhlocyba","froggatti",9.4,NA,486.4,NA,"","9.9",8.8,NA,"","","","",NA,NA,NA,"226",262.6,"","","","","",NA,NA,NA,"",NA,NA,NA,NA,NA,"","",NA,"","Teulon D.A.J., Penman D.R.",1987,"Development of Typhlocyba froggatti Baker (Homoptera: Cicadellidae) and determination of lower threshold temperatures.","New Zealand Journal of Zoology","14","543-547","New Zealand Canterbury","",9.4,171.1637245,-43.7542275
"1367","Haplaxius crudus","Homoptera","Cixiidae","Haplaxius","crudus",12.8,NA,904.3,NA,"","16.2",11.3,NA,"","","","",NA,NA,NA,"151.4",776.7,"","","","","",NA,NA,NA,"",NA,NA,NA,NA,NA,"","",NA,"","Tsai J.H.,  Kirsch O.H.",1978,"Bionomics of Haplaxius crudus (Homoptera: Cixiidae).","Environmental Entomology","7","305-308","USA Florida","",12.8,NA,NA
"1370","Saissetia coffeae","Homoptera","Coccidae","Saissetia","coffeae",6.05,NA,848.35,NA,"","7.11",NA,11.93,"4.11","","","",NA,NA,NA,"270",NA,"43","555","","","",NA,NA,NA,"291.67",556.68,69.19,487.49,NA,NA,"","-",NA,"","Li, C., T. Su, et al.",2002,"Effects of temperature on development of the hemispherical scale, Saissetia coffeae (Walker) (Homoptera: Coccidae), and its occurrence on cycad (Cycas taiwanian Carr.)","Formosan Entomologist","22"," 65-74","Taiwan","",6.05,NA,NA
"1376","Laodelphax striatellus","Homoptera","Delphacidae","Laodelphax","striatellus",12.1,NA,295.3,NA,"","11.8",11.6,NA,"","","","",NA,NA,NA,"113.6",192.2,"","","","","",NA,NA,NA,"",NA,NA,NA,NA,NA,"","",NA,"","Noda H.",1989,"Developmental zero and total effective temperature of three rice planthoppers (Homoptera: Delphacidae).","Japanese Journal of Applied Entomology and Zoology","33","263-266","Japan, Izunus","",12.1,NA,NA
"1377","Laodelphax striatellus","Homoptera","Delphacidae","Laodelphax","striatellus",12.2,NA,283.4,NA,"","11.8",11.6,NA,"","","","",NA,NA,NA,"113.6",184.7,"","","","","",NA,NA,NA,"",NA,NA,NA,NA,NA,"","",NA,"","Noda H.",1989,"Developmental zero and total effective temperature of three rice planthoppers (Homoptera: Delphacidae).","Japanese Journal of Applied Entomology and Zoology","33","263-266","Japan, Izunus","",12.2,NA,NA
"1378","Laodelphax striatellus","Homoptera","Delphacidae","Laodelphax","striatellus",12.5,NA,277.8,NA,"","12.5",12.1,NA,"","","","",NA,NA,NA,"99.7",185.4,"","","","","",NA,NA,NA,"",NA,NA,NA,NA,NA,"","",NA,"","Noda H.",1989,"Developmental zero and total effective temperature of three rice planthoppers (Homoptera: Delphacidae).","Japanese Journal of Applied Entomology and Zoology","33","263-266","Japan, Kamikawa","",12.5,NA,NA
"1379","Laodelphax striatellus","Homoptera","Delphacidae","Laodelphax","striatellus",13,NA,258.8,NA,"","12",11.7,NA,"","","","",NA,NA,NA,"107.7",183.7,"","","","","",NA,NA,NA,"",NA,NA,NA,NA,NA,"","",NA,"","Noda H.",1989,"Developmental zero and total effective temperature of three rice planthoppers (Homoptera: Delphacidae).","Japanese Journal of Applied Entomology and Zoology","33","263-266","Japan, Ishigah","",13,NA,NA
"1380","Laodelphax striatellus","Homoptera","Delphacidae","Laodelphax","striatellus",13.3,NA,247.1,NA,"","12.5",12.6,NA,"","","","",NA,NA,NA,"99.7",165.3,"","","","","",NA,NA,NA,"",NA,NA,NA,NA,NA,"","",NA,"","Noda H.",1989,"Developmental zero and total effective temperature of three rice planthoppers (Homoptera: Delphacidae).","Japanese Journal of Applied Entomology and Zoology","33","263-266","Japan, Ishigah","",13.3,NA,NA
"1381","Laodelphax striatellus","Homoptera","Delphacidae","Laodelphax","striatellus",13.3,NA,243.4,NA,"","12",12,NA,"","","","",NA,NA,NA,"107.7",168.9,"","","","","",NA,NA,NA,"",NA,NA,NA,NA,NA,"","",NA,"","Noda H.",1989,"Developmental zero and total effective temperature of three rice planthoppers (Homoptera: Delphacidae).","Japanese Journal of Applied Entomology and Zoology","33","263-266","Japan, Kamikawa","",13.3,NA,NA
"1391","Abgrallaspis cyanophylli","Homoptera","Diaspididae","Abgrallaspis","cyanophylli",4.41,NA,978.3,NA,"","",NA,NA,"","","","",NA,NA,NA,"",NA,"","","","","",NA,NA,NA,"",NA,NA,NA,NA,NA,"","",NA,"","Ponsonby, D. J. and M. J. W. Copland",2000,"Environmental effects on the development and survival of the scale insect Abgrallaspis cyanophylli (Signoret) (Homoptera: Diaspididae) with reference to its suitability for use as a host for rearing biological control agents.","Biocontrol Science and Technology ","10"," 583-594","trops and then green house in UK, Kew","",4.41,NA,NA
"1396","Aonidiella aurantii","Homoptera","Diaspididae","Aonidiella","aurantii",11.6,NA,281.4,616.4,"","",NA,NA,"","","","",NA,NA,NA,"",NA,"","","","","",NA,NA,NA,"",NA,NA,NA,NA,NA,"","",335,"","Kennett, C. E. and R. W. Hoffmann",1985," Seasonal development of the California red scale (Homoptera: Diaspididae) in San Joaquin Valley citrus based on degree-day accumulation","Journal of Economic Entomology","78"," 73-79","USA, California, Tulare county","",11.6,NA,NA
